context,text response
"Despite the anxiety, despite the depression, despite all my self criticism and imperfections - I was a beautiful bride this Saturday!","Popping in here to say that I adore how much love there is in this thread! Keep being amazing, guys."
Today I promised myself bacon and eggs if I could get myself to a coffee meet up. I was too anxious to attend last week. Guess who got bacon and eggs?!! Feeling so proud of myself for going.,Good for you! Whenever I see something with anxiety crack a smile I have to upvote :) 
"Have my first real, adult, job interview today! Not only that, but I also managed to drive by myself in city traffic! Two small victories 😊",Fuck yeah! You got this and you're going to rock it!
"Professor here, if you have missed class, please come back. We aren’t mad at you.","Just as an ironic heads-up, I stay up at night worrying about my students who miss class and lose contact. Oh, anxiety, you troublesome bitch!
"
Today is my cake day and I wanted to post a pic of me smiling for once. Things are starting to look up.,I hope they continue to look up for you! Happy cake day!!
I am busy.,"""Sorry I couldn't come, I was busy""

**""Meh I wasn't there either, what were you up to?""**

""Staying up til 5 AM browsing the internet to distract myself then lying in bed as the sun rose with my heart pounding in my ears, trying to cry or scream or look for some kind of exit from this horrible feeling, but instead just gritting my teeth and violently cringing in the foetal position because of every responsibility I've shirked and every opportunity I've wasted.""

**""Neat, me too!""**"
1. Anxiety makes it hard to go to sleep 2. Depression makes it hard to get out of bed 3. Drink coffee for a boost 4. Caffeine makes anxiety worse 5. Repeat,"Meeeeeeee. I keep promising myself to switch over to green tea, which has less caffeine, but I love the taste of coffee too much."
Message from your future self,I really needed to see this today. Thank you. 
"I was thinking why this sub has a lot more upvotes than comments, realized people are too anxious to comment,lol",[deleted]
"hey if you know someone has anxiety PLEASE DON'T TEXT THEM ""WE NEED TO TALK"" AND THEN NOT REPLY FOR 7 HOURS FUCK","My mother, who knows I have anxiety, has done this. 

“Call me later please.“

Frantically calling, ask what’s wrong 

“Nothing, just wanted to say hi...”"
My gal Sprankles - she always knows how to comfort me after a bad panic attack 😸,plot twist: your cat enjoys your panic attacks because your tears are delicious to her
"Three weeks ago I booked this trip to Hawaii by myself, and three weeks later I’m happier than ever.","I hope this inspires some of you to do something regardless of your anxiety telling you not to. Don’t let it hold you back from doing new, uncomfortable things. I hope you all are well, and even though I’m on vacation, please feel free to message me if you just need to talk. "
After 4 years of GAD and 1 year of agoraphobia - I finally went out to eat by myself... I feel like I can conquer the world!,Great job!!!
Due to severe hand tremors from anxiety I’ve had to quit sketching and inking for several years. Finally am managed enough by medication that I could finally finish this piece :),"That's amazing!! Don't stop drawing that's literally incredible. Make some of your own stuff, I wanna see it!"
Drawing I made about panic attacks and anxiety...helps me process everything in a new way,Good job with this. Understanding your anxiety and how it makes you feel is a great way to deal with it.
"Just a friendly reminder that anxiety attacks aren’t always hyperventilating & rocking back and forth. They are also random bursts of irritability, obsessive behavior and nit picking, hypersensitivity, pacing, silence, zoning out. Always look for signs with your loved ones",When I'm anxious I'm very short tempered and I feel so bad about it afterwards :(
My girlfriend made me a Calming Jar,I love this. Would you share some more of the sayings?
I was scared of leaving the house but I managed to push myself and it was pretty,I'm proud of you!
I wanted to share my new embroidery with you all as a reminder of your value ❤,You should sell these... Cuz I would fur sure buy one. Awesome work!
"I don't think people realize how much strength it takes to pull your own self out of a dark place mentally. So if you've done that today or any day, i'm proud of you.","❤️ proud of you, too!"
"This is the first time I have been to the movies since getting PTSD and the first time EVER going to a movie solo!! Had lots of anxiety, did it anyway, and now feel super badass!","I wanted to give back to all the amazing people who encouraged me to do this on reddit. So with the help of my husband who is a clinical psychologist who specialises in Anxiety i made a walkthrough about how to do exposure like this! 

I hope it helps other people to live bigger brighter lives. Would love to hear what you all think of it!

Here’s the link:

https://youtu.be/ZB0T0Uav15E

I’m so grateful to a number of reddit contributors who talked me through doing this and inspired me. I’m growing so much with your support. Thank you from the bottom of my heart. "
I WENT TO THE GYM AND I DIDN’T DIE!!! (I’ve had public workout anxiety since elementary school),"Way to go!! I know how daunting that can seem, it took me a long time to be able to do a workout outside of my house, let alone on a run or something away from people/medical help. Keep up the good work, and be patient with yourself!"
Might need a pick me up,[deleted]
Anxiety is having a wonderful day ahead of you but not enjoying it because you’re thinking about that 2 minute phone call you’ll have to make in five days.,Or thinking about an embarassing moment that wasn't even that bad that happened two years ago that no one remembers but you
"i experienced the worst panic attack i’ve ever had. this is my bunny, Chicken, helping me feel better","Been going through a bad breakup as of late. My dog doesn’t do kisses or pets, but when she sees I’m crying she comes and makes me hold her paw. "
Service dog senses and responds to owner's oncoming panic attack,I’ll take one please 
When you're calm and relaxed,The moment you become aware you’re not anxious is when u become anxious again 
Today is a hard day. My cat knows exactly when I’m having a panic attack and cuddles with me until I calm down. Animals are magical. ❤️,Oh my gosh such a sweet kitty
Anxiety is waking up 3 hours before your alarm and not being able to fall back asleep because you're worried you won't be able to fall back asleep.,Or worried you’ll sleep through your alarm
My family isn’t the most understanding when it comes to my anxiety so I lean a lot on my cats for support. I did some photo art about how I see them.,"beautiful photo 💛 pets are very life giving, they help me too. "
Ain't THAT the truth...,reminds me so much of :http://data.whicdn.com/images/45760500/funny-depression-comic-smashed-hand_large.jpg
I'm so anxious while doing schoolwork that my fitbit thinks i'm working out,"To all other college students on this sub: Good luck out there, you anxious little fucks."
Trying to sleep with anxiety is like trying to sleep with relentless pop up ads in your mind,this is the realest shit that i’ve heard this week
I made a lil comic based on a post I saw here about work while having anxiety. so here it is.,"It's just 5 in the morning and I haven't slept and I couldn't stop thinking about it so I made it and now I think I'll be able to sleep lol. 
Have a good day reddit :)

edit: Thank all you guys! 

edit2: Jeez louise. I feel so inspired and encouraged. Don't knock the power of reddit. You guys have made one of the worst weeks of my life turn into something positive and I seriously love all of you nice little bastards for doing that. 
It's amazing and awful that so many of you feels the same way. If nothing else I'm glad this subreddit is here to bring some community to the people who need it most. 
"
"Does anyone else's anxiety make them waste an entire Sunday and then when nighttime hits, your anxiety ramps up because you know you have to work the next morning?","“Sunday scaries” 
I usually use Sunday’s for cleaning, laundry, food shopping, small errands,and prepping for the week just so I can try and avoid the anxiety."
I FUCKING HATE SOCIAL ANXIETY BECAUSE YOU’RE SCARED TO TALK TO PEOPLE BUT ALSO DYING TO TALK TO PEOPLE AND HANG OUT AND RELAX AND HAVE FUN AND NOT BE ALONE AND LONELY AND FEEL LIKE SHIT BUT YOU DO FEEL LIKE SHIT BECAUSE YOU CAN’T EVEN RELAX ENOUGH TO TALK TO PEOPLE WITHOUT OVERTHINKING EVERYTHING,"I'm sure you know; but just a reminder that you're definitely not alone. It's like when you get sick and you actually enjoy it because it forces your body and mind to slow down... anxiety is a cunt.

On that note, it is possible(so I've heard, and have seen limited results myself) that it is possible to tame some of these symptoms through cognitive behavioural therapy(you can download an app on your phone), and meditation techniques (:

..The only reason that I've only seen limited results is because I have trouble committing to them."
I know a lot of us take antidepressants for anxiety so here's a map I made about it,The brain zap bay when you miss a dose can get pretty rough
Feeling so proud of: -present me- for going to my exercise class even though I was late and was anxious people would be mad. -past me- for getting up the guts to start going to the class in the first place. That was super scary! Now it’s a routine it’s easier to go.,Proud of you!!!!! 
I painted health anxiety... At least how it feels to me.,"I love it. I hate this brand of anxiety so so much because it's so hard to express, no one understands and you can't make them understand. Its so validating to see it expressed creatively."
Just managed to successfully complete a 9 hr shift at work today (I cook at a Pizza Hut) after suffering a panic attack on shift just last Sunday.,Great job! I hope things get easier.
Is this also you? Because this is me.,That's what I've been doing right now. (but I live with housemates) 
Anxiety is sending an email and then not checking your email for 3 days because you're scared of seeing the reply.,Legit me whenever i have to send a work email 😰
Do what you can with what you have wherever you are.,"I am not usually susceptible to these types of messages, but this one got me in the feels. Thanks OP ❤️"
Does anyone else ever take out your ear buds to make sure no one else can hear what you're listening to?,"One time, 13 years ago, I did this to check and a woman near me said, “Yes. You’re bothering me.”

I have never recovered. 😭"
"People with a mental illness are not lazy. They have to face an internal battle everyday. And we all know loosing the battle is not an option. We literally have the biggest, most important job possible. Keeping ourselves sane and alive.","""But what if I am lazy and just making up the mental illness as an excuse..."" said his anxiety to his mind.

""Obviously I am a completely worthless bumb, and should just kill myself, acting mentally ill to hide my laziness."" Quipped his depression. 

""Guys the OP might have a point, we do argue a lot, and you depression like to throw the suicide thing on the table a lot."" Said his possibly true inner voice. 

""But whos to say the depression isn't the true inner voice and the inner voice isn't just playing a trick on you trying to get you to stay alive through torture? "" responded what he thought was his anxiety, but was now unsure if it was his true inner voice. 

""Yes obviously you should listen to me and just go step in front of that train tommorow."" Said what might be the true inner voice, or maybe something else entirely. 

""No that's scary! Stay home, in bed."" What fucking voice is that? 

""You're obviously a lazy piece of shit."" Said one of the voices that all bled together in the end. 

*sits in place not making any decisions or doing anything, the world assumes hes lazy, and yet part of him believes it* "
"I don’t know who needs to hear this, but, unclench your jaw and relax your shoulders.",Ugh. I have to remind myself this exact thing like a hundred times a day. I clench my jaw so much that I started getting headaches if I don't catch it.
I love you and hope you are having an awesome day,been doing yoga. it actually kind of helps. 
Does anyone use their phone excessively for hours to distract their brain?,Yes. That or Youtube. I frequently will close Reddit then open it 5 seconds later. I do this with the apps I’m on a lot.
"I’m a young kid with really terrible death anxiety. For the first time, I’m visiting my grandfather’s grave. Grabbed some ice cream on the way... feeling very nervous but wish me luck, going with a smile for him! :)","I've had death anxiety ever since my grandma died at a young age too, so I can relate :(

Best of luck hun <3"
"I stopped existing to the world for three years after graduating college. Last week, I posted about attending my first full time job interview. I wasn’t expecting anything, I was proud of myself for being brave. Tonight, they offered me the position. I AM A PERSON AGAIN. I AM REAL. I EXIST.",Hey congratulations! But you mattered before this as well. You don't need to have a job to be valid
I DID IT.,"Oh my Goddd!!! Well done, I’m so happy for you!!"
"Does anyone feel depressed that their anxiety has kept them from experiencing major parts of a ""normal"" life?",That is a very common feeling.  Anxiety does make us withdraw from life.
"[UPDATE] after almost canceling a job interview due to anxiety, I forced myself to go, went in there, and killed it!!!",This is everything. I fucking love this post. You gave me motivation. Thank you and congratulations!!! Keep grinding.
Anyone ever get a surge of anxiety whenever your phone rings? Every time it goes off I just think “Fuck. I’m in trouble”.,"Yes.

I **hate** phone calls, I prefer to not pick it up and let them message me instead to let me know what's up.

I think I have a big *thump* on my chest everytime my ringtone starts blaring"
"I saw a saying that read ""Never get so comfortable in pain that you forget happiness is still an option""",I needed this. Thank you!
So I'm Iranian and I'm terrified right now.,"As a fellow Iranian, I know how you feel and I feel sorry for you that you are on the brink of doing military service. All we can hope for is a better outcome of all of this and not a war. Stay strong."
3 years ago I was terrified of driving and refused to drive on the highway. Today here I am driving across the entire US!,I’m at your “before” now and hope I can someday get to your “after.” Congratulations!!! 
If you're reading this it means I did it,No one is judging you. Congratulations on making a post!
I hope this can be helpful for those who get anxious. I’m still learning 🤞🏼,"Also, limit your time on Reddit. Reddit can be great for a lot of things, but it also is a huge vortex of negativity and judgment. Take a breather from all of that because it doesn’t represent the real world. "
Went and tried to help my neighbor start his car! Pictured is exactly how I felt!,This comic is great. You are great for trying to help. Everything is great.
"You know the anxiety is real when you always add an ""lol"" or ""haha"" to every text you send, for fear of thinking you are offending someone.","Yep



Haha"
"Do you ever feel like people without an anxiety disorder have this magic ""I don't care"" button? Like they can just choose not to be bothered by something?","Yeh, I was like this as a teenager, no matter what the problem was if I made it to the weekend I was good. Anxiety started in my early 20's and now it feels like any minor event can send my life into a tail spin."
yo FUCK anxiety,Preach
1 month with 0 panic attacks,I'm happy for you! Keep it up👍🏻
"Your mental health is more important than the test, the interview, the meeting, the family dinner and the grocery run. Take care of yourself.","Thank you for this, I think I forget far too often.

Hope you have a blessed day too!"
"Today I cleared 12 bags of old clothing and things out of my room to donate and clear my personal space, I have a job interview next week, and I start therapy tomorrow. Feeling very hopeful!","Good to clean helps,, started this as well,, baby steps,, Therapy is great and congrats!!"
"Does anyone else say ""sorry"" as an impulse?",[deleted]
"To you reading this I hope you have a nice day and I hope you get over your anxity and remember to never lose hope, you are strong. ❤","This was at the top of my feed when I opened reddit, thanks for the nice little boost. "
So yesterday I did a talk to a group of students regarding my battles with anxiety and depression...today they just offered me a job...they are willing to pay for my qualifications and offer me a position teaching mental health at their training centre 🙏...you guys are my motivation ❤,That’s amazing! Congrats!
Anyone else suffer from depression too and have to decide whether or not to drink coffee because it’s a choice between my anxiety being worse or being exhausted all day?,Even with caffeine I can’t do more than the bare minimum 
hello! i hope you guys are having a nice day. this is my therapy bunny. his name is chicken! he helps when i have anxiety attacks. this is him in his banana beanie!,Hello bunny named chicken eating lettuce while wearing a banana beanie. You are so cute. 
"TIL actress Kristen Bell has struggled with and received treatment for depression and anxiety. She said, ""It's important for me to be candid about this so people in a similar situation can realize that they are not worthless and that they do have something to offer."" : todayilearned","I saw a PSA she did where she takes about how her mom and grandmom (edit not grandson) both struggled, too, and when she was a teenager her mom sat her down and was like “Look, I’ve struggled and so has your grandmom, so you might too. If you ever feel like life is just too hard - talk to a doctor.”

Chills every time. I thought it was such a good way to not pathologize every behavior or bad mood but still let someone know that genetics suck and to keep an eye out. "
Unclench your jaw,"Luckily my anxiety has kept me from going to the dentist for years and enabled horrible hygiene so if I clench it hurts. 

Did I win..?"
"I went to groceries, i cleaned my appartment and I cooked myself a burger with potatoes for the first time in 3 months.",Awesome! It’s the small victories that make a big difference.
How many of you guys lurk the anxiety subreddit but don't post/comment?,"Wow! So many people posting for the first time!

I am SO proud of all of you! It takes a lot of courage to start posting. Congrats on taking this step!

And I want to give a shout out to everyone who has upvoted, but hasn't posted! You guys are important, too!

Everyone here, whether you are a lurker, commenter, or poster, regular or someone who just pops in occasionally, is a vital part of this community. Thank you all so much for being here and making this place what it is. We wouldn't be here without you. We're all rooting for you."
"Does anyone get so anxious about class that they don’t go, but then it makes your anxiety even worse because of the guilt from not going?","It's a vicious cycle. I'm in law school and the amount of stress leading into finals makes me incredibly unproductive and I'm out of days I can be absent from school. Even when I try to relax I feel super guilty about not doing work.

I finally did take a full weekend break last week when a friend of mine came to visit and I was able to relax without freaking out about all the work I needed to do. That break (hopefully) gave me the energy to continue trucking on. 

2 more weeks and my second year of law school is over. Only 1 more to go *sigh*"
"Does anyone else get overwhelmed and anxious as soon as they have a responsibility to fulfil (answering a text, an email, etc.)?",Yep. I'm getting worse as I try to manage my anxiety too. Like I put it off till it's over due even if it is something so simple.
Does anyone else replay their conversation in their heads and worry they said something that pissed the other person off?,"All the time yes and it’s not just talking ,it’s when I text as well"
"I’ve failed my license test 4 times because I have test anxiety, especially when someone’s sitting next to you writing notes but today I PASSED! It was so scary but I finally did it (I’m 21)",Congratulations! 👏👏👏👏🎊🎉🎊🎊. I've had anxiety too when taking both tests (written and driving) and got my license when I was 23.
I’m anorexic and have several anxiety disorders and I went grocery shopping by myself for the first time in 6 months! ☺️,"Good job!

I haven't grocery shopped proper in a month. "
Today I gave a presentation to a room of 30 people. My voice broke a lil and I was kinda shaky but i still managed to not completely lose my voice (usually happens) and I’m proud of myself 🥺,One of the hardest things to do. Good job on being brave!
Took a huge step. Went to see a therapist today. Had a panic attack while leaving went there crying and all. But I did go.,Wow congrats on the progress you made to finally see a therapist. Bravo! I hope future sessions will be better for you. All the best to your therapy sessions.
Climbing the panic attack mountain (art),"I get these almost every day especially when I’m not distracted or engaged in an activity, especially when driving. I think it’s due to boredom or something. 

Anyways can confirm this is how it feels (at least to me), especially the dying part. Awesome pic thanks for sharing!"
Skipping classes for my mental health...which impacts my grades...which impacts my mental health.,Exactly what happens to me. I did it on school and now I do it with work...
"understand this: you can sound confident & have anxiety. you can look healthy but feel like shit. You can look happy & be miserable inside. you can be good looking & feel ugly. so be kind, because every person is fighting a battle you know nothing about","So true! Especially when dealing with customer service people. You have no idea what they are dealing with on a regular basis. Jerk supervisors, annoying coworkers, other shitty customers. Plus whatever is going on in their personal lives. But they are forced to wear a smile and be super nice no matter what they're dealing with. Some are fighting back tears their entire shifts and drive home crying, and all for shitty pay with little appreciation.

As someone who not only deals with anxiety and works customer service I try my best to give back a little bit. Not just with a decent tip but saying things like ""you're amazing!"", ""thank you SSOO much!"", and sometimes, when I'm really happy with the service ""I love you!"" You'd be amazed the smiles you get from these small words."
Best explanation I've read about how dealing with both depression and anxiety feels... [x-post r/depression],"I've always thought of it like this:

Depression is your whole body slowing down (no energy, eat less, sleep more, etc). You're get-up-and-go is gone. 

Anxiety is your mind sped up. (more thoughts, more worries, more fears, etc)

When you add slowed body to sped up mind everything becomes off kilter and unbalanced. You feel like you're fighting yourself at every moment and getting nothing accomplished despite so much energy being exerted. 

"
"My biggest fear is that my anxiety will always keep me in my ""safe zone"" causing me to live a life of mediocrity that I will one day really regret.","Anxiety is the disease of broken dreams 

It will prevent you from going to college  or doing well in school 

It will prevent job interviews, meetings, etc

It will hinder you from meeting others and dating 



Make the decision today: give in to the anxiety and remain in the safe zone, or challenge it and routinely put yourself outside of your comfort zone 

Do one thing each day that scares you."
"Anxiety isn’t cute, anxiety is thinking someone died because they haven’t messaged you in a day.","When my husband isn't home by like 30 minutes past when he usually gets off work I start thinking he's died in a horrible car accident on the way home.  But I'm afraid to text or call him in case he checks his phone while driving and gets into a horrible car accident and dies.

He's come home to me pacing a rut in the living room floor too many times, and in the last couple weeks has started texting me the minute he knows he might not make it out on time.  I feel like a crazy person, but I also appreciate it so so much."
"Anxiety didn't win, I'm graduating high school in 4 hours!",im so proud wow this is an achievement!
"PSA: NEVER let a bad day/week/month convince you that you haven't made any progress. You're better off now than you were a year ago, and you will persevere further.","I'm more depressed then anxious, but use video games to trick myself into a sense of progress. I may not have gotten the dishes done yesterday, but I did defeat the Hornet in Hollow Knight."
Anyone else get anxiety when you notice the slightest change in how someone speaks/treats you,"yes. It's part of the illness. The craziest thing is that people with Anxiety live with so much emotion bombarding them all the time and they are dealing with it all the time yet when another person is ""slightly off"" we freak out and blame ourselves. Calm down. People have good and bad days and act accordingly. If someone has a problem with you the protocol is for them to bring it to your attention or suck it up. The end. 
"
