context,text response
Isn't anxiety great when all you want to do is sit around because you're mentally exhausted but your brain convinces you that you're going to get cancer/heart disease/fucking every illness ever from not exercising,Are you... me?
Does anyone else get tired of people telling them to exercise as if thats a cure-all?,"Yes, exercise works for me but only while I'm exercising. Therapist seems to think that's good news. "
"Does anybody else purposely listen to music they enjoyed when they were younger, as it reminds them of a time when they were not adversely affected by anxiety?",That's pretty much everybody over the age of 25 though. 
Does anyone else get really bad anxiety when it comes to talking on the phone?,"I have the same problem.  The phone rings and I get a knot in my stomach, my heart starts to race, I get nauseous, I begin to sweat, and I start to shake. 

This article has some really helpful tips on how to deal with phone anxiety:   [https://www.verywellmind.com/afraid-making-phone-calls-tips-3024317](https://www.verywellmind.com/afraid-making-phone-calls-tips-3024317)"
Anyone imagine who they could be if they weren’t crippled by anxiety?,"During my last session, I said something similar to my therapist: I miss the person I was before anxiety took over.

And she gave me a suggestion, or a coping technique maybe: ""Tomorrow try to do and think playing the kids game, *let's pretend*. Tomorrow, before doing or thinking something, let's pretend that you are still that person, and think or do what that person would do"".

I've tried, and I must admit it works a little. 

Maybe it can be a trick useful to someone else

Edit: grammar (sorry, not native speaker)"
Anyone else call in sick for work because of extreme anxiety and you're exhausted from trying to act 'normal'? And then feel really guilty? Argh!,"Yes!! I've done this. And then been exhausted by the guilt and additional anxiety about work I will go back to. But yes, the exhaustion of putting a face on has seen me call in more than once."
Does anybody else feel like your anxiety has totally killed your curious and creative mind? Read more inside.,"One of my hobbies is I'm a musician... A lot of the time my mind is focused on the fact that I'm not good enough and what other people think of the stuff I make (Especially when I cross reference stuff)... It not only makes me less creative but makes me demoralized and just want to quit all together so I don't work on stuff... as a result I don't improve and that feeds back into the problem. Its not just music either... but my university work too. 

In summary I feel this all the damn time and I hate it so much..."
"Does anyone else have this thing where if strangers laugh near you, they must be laughing at you?",I get this sometimes and I'm in my 30s. I don't think it's an age thing. I think it's related to social anxiety and that intense feeling of being judged by everyone....being hyperaware in social settings.
I finally did it!,GOOD JOB!!! SO PROUD!! PROGRESS <3
I’ve applied for two jobs!!,"Good luck! I bulk applied (at least 50 or so) when I was looking and generally only ever got 2-3 interviews. Make sure you apply for something you want to do and not because it's A Job, and if they see your personality shine through and like it you've got it! If not well so what they're missing out on YOU!!!

(Edit: no way meaning to brag because that's not my intention at all, my point is I would worry so much about not having A Job and I was miserable at my first from underpayment and being abused by my boss and one of the managers and felt obliged to stay until I found something else, so don't feel tied down to a job if you don't like the work or the people!!!)"
to everyone reading this ...,"You too!
Best wishes!"
Anyone ever had anxiety that makes you not want to eat?,"Severe anxiety causes stomach issues for me similar to your description.

My anxiety had a daily cycle. Mornings were the worst. In the early evening it would let up until bedtime. I tended to eat a decent meal in this window of relative calm. Monitor your anxiety and see if that will work for you."
Going non verbal when you're upset/stressed?,"That sounds just awful!!!! 

When I visit my family over the holidays (or any other reason), they make sure to let me have my own room where I can escape to 

I get nonverbal when overwhelmed/overstimulated as well"
A week with no panic attacks!!,I wish I could upvote this a million times!! Congrats and keep up the good work!
Is it normal to have fun while drinking then feel depressed and over-analyse everything you did when you sober up?,"I find alcohol makes my anxiety flare up the day after, if I had got really drunk the night before. I didn't drink super often  but  the after effects I experienced mentally were bad enough to make me quit completely for a while. 

I agree it can be easier to come out of your shell, but for me at least finding balance with drinking was important. I have to drink slowly and don't ever get full on wasted anymore. The buzz helps me feel comfortable partying/talking with people/even singing karaoke but does not leave me with anxiety attacks or insecurity the next day.  

It's easy to over analyze yourself and your actions after sobering up. Can you talk to the people you were with, maybe get some reassurance about how they were receiving you? It can be anxiety inducing to have those conversations but if it's just you over analyzing, talking to them could really help you feel better. "
"""In 3 hours it'll only be 1 hour until I have to go to work... In 2 hours it'll only be 1 hour... In 1 hour...""",I do this too and I don't know how to stop.
I did it!! I left my house for the day and had fun!,"That's awesome man! It's great when days are super good, especially when it's doing things that make you anxious. I hope you continue to have more good days (•ᴗ•)"
Sometimes I hate being alone but when I finally go out with people I can’t wait to go back home and be alone again. It’s like I want to be more social but then think maybe I don’t really want this. Anyone else feel this way?,"Yeah, I got tired of this cycle and just stopped trying to be social in real life, and I'm honestly happier for it. This might be an unpopular answer, people usually advise forcing yourself to socialize until you like it, and maybe I'm just wired wrong, but I just don't really feel a strong drive for company. Chatting with people online is sufficient. "
Does anyone else shut down when being yelled at?,"This happened to me a lot, but that’s because I  grew up with a dad who has anger issues, so anytime someone yelled or argued with me I would be filled with anxiety and fear and spend the rest of the time thinking how everything is my fault and how much I hated myself. 

I still feel like this at times but i just distract myself with video games or something until I calm down and collect my thoughts. I reflect on what happened and the other person’s perspective and that usually clears the depressive thoughts away especially if I go back and have a conversation with that person."
Downvotes make me extremely scared about what i said wrong,"I take downvotes really personally. I won’t even post in most mainstream subs because I’m so anxious about getting downvoted. None of this is healthy thinking, and I shouldn’t care so much about what other people think of me. And all of that’s well and good but, ya know, brains don’t always listen to reason."
Ever feel overwhelmed by the amount of evil in the world?,"I'm costantly overwhelmed by this kind of thoughts, and by all the nasty things my actual government could do more.

Sometimes, I am able to cope with it by thinking that I'm not alone in my disgust and fears, and if the times will come I will find other persons who'd want to fight and change things. It helps a little."
Does anyone else get anxiety when they are waiting on someone to answer them?,"I feel this alot. I always assume the worst: they hate me, I said something stupid, they secretly don't like me. If it's someone I love (like family) I assume the worst--there has been an accident. The best I can do is try to distract myself and not focus on those thoughts too much..."
"I stole this from another site, but it's pretty accurate imo. Anybody else get this response from others? This pretty much describes why all my relationships have failed. I have yet to meet someone who understands fully, let alone date them.","When I get really anxious, I get angry which is a huge problem in a lot of my relationships. I feel that it's accurate. "
I asked for a different lid today,Doesn't sound like a faluire to me at all. Also asking the lady to take it of and explaining the situation is great. You did well
My anxiety makes me feel that I am running out of time and I am only 21,Im also 21. I constantly feel extra anxious all the time because I feel like I'm wasting my life due to anxiety. I don't get any enjoyment out of doing things I like because im always so stressed. I just recently started Zoloft though so I'm hoping it will help me otherwise I don't know what to do.
New spin on anxiety: we are just superheros with an extraordinary amazingly functioning fight/flight reaction,God had to nerf us because we are too powerful
90 days.,This post caused me to try and get help from a crisis textline. I guess I should say thanks?
things anxiety has taken from me,It took it all in a desperate attempt to keep you safe from your fears.
Anyone else get really anxious any time your phone vibrates?,[deleted]
"7 tips for reducing your anxiety, without taking meds or going to therapy",Avoiding caffeine is so important. In fact it’s contraindicated for anyone with an anxiety disorder. I’m a social worker and studied the DSM 5 as part of my master’s degree. People with anxiety and/or who take medication for anxiety are meant to be counseled by their doctors/clinicians to avoid caffeine.
Anxiety disorder is like having a broken house alarm in your mind which consistently goes off despite no apparent threat being present.,Couldn’t have said it any better myself
I've asked someone to go on a date with me she said yes :),Amazing job on asking in the first place and congrats on getting a yes!! Hope you have a great date!
"My anxiety should have lost me my job, but my boss is amazing.",That’s a really great boss but it’s extremely concerning that your job is making you ill. What is your position? Perhaps it’s too much for you to handle. My husbands job is causing him to have high amounts of stress and depression and he’s realizing that he needs to find a new job
"I cooked a whole meal just for myself today and I know it's not much, but I'm kinda proud.","[Images](https://imgur.com/a/ADK96EP) - just the soup was from the box

EDIT: Thanks for all the support, guys and gals!"
When you get anxiety because you finally feel relief from anxiety and you’re not sure how long it will last,"Absolutely. When anxious is your normal, happy is abnormal. So you question it. Questioning is an easy way to trigger anxiety because you can talk yourself into believing that irrational anxious thoughts are legitimate. Unfortunately the best way to get over this is to develop coping skills and use medication. When you can sting together a few weeks of being low anxiety or free of anxiety, it's easier to view anxiety as something that's manageable. When it's everyday for you, you think it's forever. Anxiety messes with the way you think and it creates anxious habits. Habits break when you stop performing them. Treatment and hard work beat anxiety, you just need to ensure the discomfort that comes with the process. Meds and therapy makes this process easier."
does anyone else watch TV/youtube to hear/see other people without actually socializing?,this is why i watch the office all the time.
What Anxiety Feels Like.,"I would just like to say...the fox/horse thing isn't a bad guy.  Anxiety makes us feel very put upon when other people challenge it because it is such an immediate and overwhelming feeling.  I feel like everyone out there who has anxiety should tattoo ""It's not his/her fault"" onto their arm because we tend to take it out on the people around us.

I have very situational anxiety, certain tasks are just incredibly difficult for me to do but to the average outside observer I look stress free.  My girlfriend has very broad spectrum anxiety but she has no trouble doing the things which paralyze me.  Sometimes when we absolutely have to be somewhere and interact with other people I have to push her and I never emerge from that battle unscathed.  However, on the drive there I'm a mess because driving through the city and being punctual are problems for me and I can get very frustrated and snap at people if they bug me while I'm in the car.  Eventually we realize how ridiculous we are being, we know it's not 100% in our control, and problems evaporate.  If we were just comforting to each other in our times of stress and never pushed each other to get past it we would never go anywhere, sometimes you need a push and you should be happy that you have people around you willing to push."
Does anyone else also understand that their thoughts are irrational yet they coninue to feel anxious?,"Yes! I know I am creating impossible scenarios in my head, but I still feel panicked anytime anything happens and I just read so far into every little word said and written to me. Some things really are what they mean on the surface."
"Living with anxiety is a lot like driving a car that idles high; you can still get out and go places, but you're going to run out of fuel much faster.","I definitely connect with this, it feels like social situations run me out of power, and need solitude to recharge."
I survived my interview!,Yay!
Does anyone else get upset and hurt when your posts or comments get downvoted?,The Internet is full of assholes who get their kicks this way so try not to let it bother you to much 👍
"Is anyone else introverted most of the time, but very extroverted in friend groups or people you're fairly close with?","I am like this. I love smaller groups or one on one hang outs. I completely shy away from parties, large group hang outs, etc. I have been known to attend parties and then disappear quickly without saying bye to anyone. haha. i've accepted this about myself. i'm extremely friendly and open as long as it's a small group. i also love time alone. "
I painted the physical manifestation of how i experience anxiety and thought some of you might relate.,"I LOVE this painting. I've always been interested in paintings representing mental health disorders, usually because I can relate to them. This is definitely one of my favorites on so far. 
Keep up the good work!
Lily"
I'm really tired of people just telling me to stop worrying or fearing things,As if anxiety is a choice.
Hey. Hey you. *gives Internet hug* It's going to be ok,"I needed this today. Thank you. *returns internet hug*


It's going to be ok for you too."
Anxiety about making noise,"I stop the microwave before it goes off. 

I don't have any advice, but I feel your pain."
Anxiety has completely and utterly destroyed the person I was before.,I feel you random internet stranger. I wish i had an answer for you but sadly we are in the same boat. Sounds sad but its like im just hoping that something in the future will make it all worthwhile.
Anybody else feel like they are addicted to rewatching old comedies because the familiarity of it soothes their anxiety?,"I do the same with certain shows or movies. I compare them to a “warm hug.” They’re comforting, soothing and make me feel at ease. The familiarity of them means no surprises which allows me to relax."
"I'm too mentally ill to be a ""successful"" person, but too competent to be a total disaster.","It's the worst gray area.

Too broken to succeed, too well put together to be happy with mediocrity."
"I delete posts and comments before posting them, because I fear the reaction. Does anyone else get this?","Yeah man, I do it with reddit posts, reddit comments, Instagram stories, texts, work emails, YouTube comments lol.

Sometimes you can sit there typing a comment or email out for a good thirty minutes to try and cover all your bases only to decide to delete in the end anyway.

But hey, you posted this one so good job 👍"
Do you guys ever sit and run through things you've said today and hope you didn't upset or offend someone? Or look stupid?,"All.The.Fucking.Time.

I’m a people pleaser, 100%. I take an incredible amount of time to respond to people sometimes because I’m afraid of my words being skewed. Or if I feel as though I upset someone, I contact them hours, days, months, even years later and apologize for upsetting them or saying something the way I did. I spend too much time being indecisive because I want to make the decision that’ll make others happy. It really got to a point where it was doubling my anxiety and making me depressed. This last month I have been working on doing things for myself and caring less about what people think of me, and so far my smaller victories have felt so liberating. It’s hard and I still struggle at times, but overall I’m much happier and care-free than I used to be, and that’s worth it to me. "
Shotout to those heading back to work today after a break,Needed this. Thank you friend.
"Anxious when I’m not doing anything, but too anxious to start because there’s so much to do","Oh yes, this is me alright. Or well, for me, there's like multiple angles of attack on my productivity, and this is one of them.

So I find that there's a few things that help me handle the anxiety. First piece of advice is to fully accept failure. It sounds weird, because not getting out of bed doesn't really seem like a failure, but the 'chain of anxiety' almost inevitably comes around to the thought of failure, no matter how abstract it is. If I don't go out of bed, I won't get to do x, therefor I fail by default. But if I do get out of bed and start doing x, then I'm almost certainly going to do something where I risk failing, (translation by anxiety:) so I'll fail anyway. This will lead your mind to go into this death spiral of 'doomed if you do, doomed if you don't', and before you know it, it's midnight and you hate yourself.

As a followup, the mentality I'm trying to teach myself is that ""Accepting failure is not the same as not trying to work for success. It's the opposite, as it will give you the strength to face failure and work through it. To trust yourself to be there, come storm or come sun.""

Which ties into nr 2, which is trust, in my experience. You need to learn to trust yourself, even if you don't feel like you've deserved it. I find that my anxiety is a lot weaker when I imagine myself standing up for myself no matter what happens. If I fail the exam, then I promise to study up and do it better the next time. If I pass it, well, cheers! To trust yourself gives you 'some solid ground to stand on', or that's how I think about it. Trust in other aspects is important as well. If there's a day you're sick, you need to be able to trust yourself without having to ruminate about whether you can get back into the work when you're better.

3, for me, is to keep in mind why I'm doing what I'm doing. A lot of the time, anxiety can be really really painful, and sooner or later there's gonna be a voice that goes ""why even do the thing if it's painful?"". If you haven't gotten your own intentions and desires in focus at that point in time, you will have to concur to that voice, ""I'm not sure"". Especially since losing sight of why something matters can mean that you end up going down routes you're not actually interested in. Like, making classical music because you think it sounds fancy and seems like a good challenge, rather than because you like to make classical music.

4, if you do get started, take anxiety breaks. You'll learn over time when anxiety needs to be 'handled' and when you should power through it. Generally speaking, all anxiety needs to be consciously handled sooner or later imo, but you don't necessarily want that sooner to be 'right now', as you're mid-work.

5, the other person mentioned the idea of starting small, and this is absolutely vital. It can be REALLY small, like, literally just opening the document or making sure that whatever you have to do to get started is extremely simple to get started on. Like, if you're writing a book on your computer, keep the file for the book in the center of the desktop or the like.

&#x200B;

These are just some of my own ideas, I'm still struggling with it all, but it's gotten somewhat better lately.

... Somewhat, heheh, aaaah fuck."
I'm not ok.,"You'll be ok. Don't be afraid to look for some help tho, your not as alone as anxiety wants you to feel. Its ok for your kids to see real life pain, would you want them to hide pain from you? I hide mine from my parents, which I learned from them."
I FINALLY did my dishes and I DIDN'T get Anxiety!,Good work! Go you.
Do you ever feel like your anxiety isn't bad enough to be valid?,"I was just diagnosed recently and totally understand where you're coming from.  I've always had certain trains of thought and certain habits that I now know are anxiety-related but they were just 'normal' for me.  Some of the stories I've read here have been so heartbreaking with what people deal with and then I look in a mirror and think ""you don't have it as bad as X, you can't have problems.""

&#x200B;

Yeah, brains are not our friends sometimes.  :(   Sending Jedi Hugs/ internet hugs your way if you need them!"
This is a reminder to anyone reading it that you ARE stronger than your anxiety and you CAN conquer this day.,Thanks. Mine is debilitating today and I still have an 8 hour shift to get through. I need all the encouragement I can get.
I gotta remind myself that it's ok to feel anxious every once in a while. I don't need to beat myself up for feeling this way. I don't need to find relief. Or so the reasons why I'm feeling it. Just accept it let it pass and life goes on.,"Excellent point. Worrying about anxiety often just makes it worse. It's better to recognize the situation and note ""I am sometimes like that. Traits of a genius, I guess."""
Does anyone else get anxious when plans are made or changed at the last minute?,Yes!!! It's ruining my life right now haha
DAE clench their teeth subconsciously??,"yes, all the time and while I sleep. It's starting to cause pain for me, which I guess means it's time for a mouthguard at night."
Does anyone else have this exact problem?,"Yes. That's very common.

I'd recommend asking a close friend or family member if they can help you book a time with your doctor or a therapist of some sort.

I find that the hardest part is getting started with the therapy process. Once I get into the habit of going, it gets much easier for me."
Does anyone get embarrassed over the littlest things?,"I'm sorry, Sempiternal9,

But i actually thought the whole scenario was so darn cute, i laughed in spite of myself.

I can't believe you hate yourself for being actually, very adorable.  Seriously!

I was the same way.. heck, actually every human feels the same way.  It's called the need for perfection..

I think, that once you get the hang of just knowing that you don't have to do EVERYTHING perfectly, that's at least a start.

I applaud you for several things:

1) You decided to go to the Opera House.  Many of us who have anxiety, can't even get out of the house because of it.

2) You decided to GO OUT and watch a ballet.. again. You didn't stay at home and watch it on Hulu or some other streaming service.

3) You dressed yourself.. Many of us can't even do that without criticizing ourselves right out of going.

4) When you slipped, just know it wasn't uploaded on Youtube, and broadcasted TransAtlantic, for $1.00 per click.

5) I can't tell you how many times i've slipped and said: *""You too!""*.. One time i said it at a damn funeral after someone told me, ""I hope you get over the grief of your mom, soon."".  

Just being aware of how critical you are of yourself, is growth.  And i will not even try to deny that people aren't ""judging"" you.  There are some that aren't even aware you are there.  And there are some that are.  Some people will think negatively of you, and there are those, like myself that will look at you, and appreciate who you are, inside and out.

Your main objective in life, my dear, is not controlling them.  Your main goal is to think highly of yourself.  When you start doing that?  You'll be so surprised at how much you no longer care what others think.

(There's plenty of YouTube videos and books regarding ""Not giving a crap what others think"") for starters. :)

&#x200B;"
I just asked my crush out and she likes me back!,of course!  Congrats i’m so excited for you.  You may have anxiety or butterflies in your tummy 🦋
"Does anyone else have the feeling of being on temporary time? Like, ""Things are just weird right now. I'll have everything together soon.""","Yes, yes, yes! Constantly. "
"This is to all the people who are jobless, skipping classes, or completely hopeless in life because of anxiety disorders",Thanks. I needed this today.
Stopping yourself from having thoughts incase someone MAGICALLY reads your mind?,Yeah lmfao I always think that people can see my thoughts sooo annoying...
"Anxiety is like the ink splatter in Mario Kart, it tries its hardest to blind me but I will always push through til it fades.",I’m gonna start thinking of this when I get anxious. I love this.
