context,text response
I was just elected to City Council tonight.,"Congratulations on your victory. You championed your Anxiety for this fight. Also, congratulations on being elected. We got this together. Rome wasn't built in a day, neither were we. We'll do this the same way we always have, one day at a time!"
Does you anxiety ever make you feel like the people who love you the most actually think you're the worst person ever?,"It’s completely understandable to feel like this. Especially because you don’t like or love yourself so you begin to doubt the ones who do. 

The biggest thing to remember is that they’ve been with you this long, through all your ups and downs so of course they love you!!"
I graduated college today,I can't achieve my goals but congrats🏆🏆🏆 happy for ya😊
Anxiety is having to leave for work at a certain time even though you know you’re still going to be 30 minutes early,"Anyone else get ready 20 minutes before you actually need to leave, then just sit around being anxious for 20 minutes?"
Being around people all day is just exhausting.,"Absolutely! I’m an outgoing introvert — when in groups, I’m charismatic, funny, and social, but after a few hours, I can physically feel my “Socialization Health Bar” decreasing. I talk less and become more of a listener. Then I need to go home and be alone to recharge that “Socialization Health Bar” for the next day."
Currently at the movies alone for the first time in my life. I’m kind of freaking out with my hands shaking but I’m also a bit proud I’m doing it - going to the movies alone has been something I’d always wanted to do but been too anxious and self-conscious to do,"Just so you know, literally no one there cares that you’re there alone. And if anyone notices, nothing bad will happen to you. It’s all good."
anyone else find they need near constant background noise to help stop anxious/depressed inner thoughts?,Yup. It's why I fall asleep to TV and am always listening to something
Hey,We will see better days. Happy New Year! 🤗
"Things that helped me manage my anxiety, maybe this can help you too","Great read. It's a battle but know that you are not alone. Going to try a few of your tips. 

&#x200B;

Thank you!"
"I’m finally leaving this sub, best of luck to all of you, wish I could hug every single one of you.","I'm recovered thank God because of Cognitive Behavioral Therapy. But I'm sticking around to help others suffering, paying it back and forward."
I’m so proud of myself. I just started college. I’m a week in. I haven’t had friends to talk to in person in years. I made 4 wonderful friends and they made me so happy last night.,That's awesome! I move in 3 days from now for my freshman year. Hope everything goes well for the both of us
The Mayor of my town posted this on Facebook this morning...great message!,"This hit me hard, it's like what everyone who was in my life have just blown it off and let me suffer including my parents, closest friends, and boyfriends. I wouldn't wish a panic disorder on anyone, but for one day, if it made everyone understand, I might. I'd love to switch for a day and see what ""normal"" was"
Anxiety is trying to stop me from going to a car wash so I’m going to the car wash in an act of sheer disrespect towards anxiety,"You’re brave for getting out. 


Anxiety is a shit roommate, so please be shitty to it in return."
Hey if you're reading this and your in a bad spot mentally or anything I hope you feel better soon and have a good day.,Thank you
Can I just say...,But... I always lose.
"When someone tells me ""it's all in your head""",If you could think your way out of an anxiety disorder it wouldn't be a disorder.
Anyone else get panic attacks when they’re family starts yelling/arguing?,Big reason why I developed bad anxiety and started having panic attacks. What I did was to lock myself in my room and pretend I didn't exist. What I should have done is get out of the house and go for a walk or anything but stay inside hearing all the yelling.
I don’t know who needs to hear this but EVERYTHING IS GOING TO BE ALRIGHT!,How? Elaborate
"Hi everyone! Long ago i heard (or read) someone say something about anxiety that help me a lot and i'd hope it could work for you too: ""Anxious people are some of the most courageous people on earth because they face their fear everyday""",I like this. Makes me feel better :)
I got on stage in front of 600 people to deliver a speech for a public speaking competition... And I won!!!,Congratulations!  That took guts.
Where I hang out when I'm freaking out. It helps! Just need a weighted blanket now,That's brilliant! I've dreamed of having a little nest like that.
"UPDATE TO: This past weekend, I overcame my anxiety and decided to shoot my shot: I asked out a guy I have a huge crush on and he said yes!! We're going out to get coffee soon 😊😊","you made a big step by asking him. you took a shot at it, which is what counts. If he's currently with someone just keep in touch and look for someone else, don't focus on him. There's plenty of people out there :)"
Are you ok? Leave your user name and I'll check in on you at least once this month and ask you how are you going.,This is the kindest thing I’ve seen on here in a while. This world is lucky to have people like you. Thank you :) 
"Does anyone ever feel so bad for saying no to someone that you end up saying yes, and then end up in a situation that you can’t get out of but should have never been part of...?"," I hear ya, especially if it's family. Often they'll ask for help, and I'll auto answer with something like, ""Sure, in a bit"", which ends up being hours later or not at all. Then I have to fight the anxiety of having to face them. 

Dunno about your situation, but for me I think I may be trying to please (the person requesting) and also neglecting my own needs. May not help me that typically if I do declined then there's a slew of questions which I also rather avoid. :(

Hope this was a bit helpful, cheers"
"If you see this, you better have a good fucking day!",Thank you friend. Needed to read this today.
Worth remembering if you're having a bad day.,"This needs to be posted at the front of my diary, in my cubicle, on my phone, hell, tattooed in the palm of my hand for quick, sweaty reference. Thank you."
This is how you can stop cringing at that embarrassing thing you did 5 years ago!,I have a few memories of other people's embarrassing moments.
Um hey,That’s awesome! Congratulations! It’s only going to get easier from there so keep up the good work! 
I drew how anxiety feels to me sometimes.,[deleted]
"Today is one of those days with Anxiety. If you have it, you know.",I swear is today everyone I know who has anxiety is feeling extremely low.
"After months of unemployment due to anxiety and depression, I’ve now landed myself a job","Congrats! I’m due to be returning on a gradual return soon, and I’m terrified how I’ll be able to handle my anxiety while there (my goal is basically not to leave..). Hoping your post helps inspire me to make it through. "
Hello this is an experiment.,"Hello! Thanks for posting. 😊
Hope you're having a good day too! "
PSA Reddit drug dealers are trying to prey upon /r/anxiety and /r/depression users.,"Hey, guys. We're locking this thread as discussion seems to have completely derailed.

If you're messaged by any users soliciting drugs, report them to the admin via [here](https://www.reddit.com/message/compose?to=%2Fr%2Freddit.com&subject=Spam)."
"Does anyone have a ""hangover"" period following a high-anxiety/stressful event?","Yes. I feel like I am drunk or hungover. My brain feels like mush. So I used that time to try and just experience, if that makes sense. Just lay in bed and feel- the bed, my clothes, etc. I essentially reset my brain and have a numbness. Breathing normally and shit

Edit: I'm so amazed and happy that so many people could relate to this! ❤ it will get better... or I hope so"
"To anyone not having a good Christmas due to family,",I just need a fucking vacation
"Hey! Lower your shoulders, unclench your jaw and focus on breathing.. it’s gonna be okay","Trying and have had a headache for three days now. Tbh, I think the headache was initially brought on by the pressure change from a heavy rainstorm, but still my jaw has been hurting for three days."
I just had a small conversation with two girls in my class AND I DIDNT OVERTHINK IT they were so nice and we laughed a little. And I even went to the board today to participate in my maths class and I volunteered for it!!! And I dont feel nervous I just feel excited and happy and accomplished yay.,"Fuck yeah bro

you can kick your anxietys ass

show em whos boss"
It's okay that that cringy moment happened to you in highschool,High school? I'm too busy replaying the way I said hi to my neighbour this morning.
Does anyone go over all the stupid and awkward shit you’ve done in your head over and over again?,I do it all the time and I HATE it. I go over stupid stuff that happened years ago and get embarrassed about it
Hadn’t Left the house in four years update.,"This is incredible! It's great that you've been able to rebuild your life after your breakdown. Something similar happened to me, so I know how brutally difficult it can be to do that. Thanks for sharing this here - it will inspire a lot of people."
I made a HUGE breakthrough today!,"Hey, that's an amazing accomplishment and pretty inspiring to be honest with you to people in similar positions. What gave you that 'nudge' to schedule an appointment if you don't mind me asking?"
"for someone who is anxious about money, I sure do keep spending money as an outlet for anxiety",i relate to this too much
"Today, so far, I’m okay. Most people don’t go on here on decent days, and I don’t blame you at all, enjoy the crap out of it. But to those that are here and in a state, look, I’m on the other side today. You’ve been okay before, you’ll be okay again. You’re doing just fine. Breathe. :)",Some days are better than others ✊🏼
Have you guys been crippled by your anxiety so much that you just don't do your assignments?,"I have this kind of problem. When i get anxious about anything , my head just tells me to not do it and my body stops moving as if im in chains. Even when i feel like dying or having a depressive episode because of it. I literally have to force myself before i can go and drink prescription meds because my head says i shouldnt do so.. its insane. Its like i want to suffer. My parents asked me why im choosing to be this way , and idk how is it choosing to be this way when i cant control myself?  If anyone knows how to get past thru this please do tell ."
Who else has anxiety about not doing enough with their life?,"It's really a shame that the current system makes us feel that way. I'm pretty sure most people feel like that. The thing is, you need to know what you personally value and then act according to those values. Do you value success more than holistic living? Do you value money more than happiness? Do you value work more than creativity? You should prioritize your values according to your preference. Then you won't be so doubtful about the path you chose for yourself.

There's also this [video](https://www.youtube.com/watch?v=OCO8eoDWqHQ) by Hank Green that I always love to share talking about jobs and careers and life."
Anxiety blob,[deleted]
"I bought myself tickets to a concert about two months ago just for myself. I forgot about it until this week, but I’ve been really excited about it! Every single day, I’ve been looking forward to it and not dreading it. I’m not even worried I’m going by myself.",Excellent! Who are you going to see?
Anxiety is just your brain coming up with fake news,"For me the bad thing about anxious thoughts isn’t their content, it’s that I am forced to hear them"
Anyone else have to basically be dead to call off of work and not feel guilty?,"My husband is like this. I think the only reason why he can actually ask off now is because I encourage him about it. I know how hard it is for him to do so, but when he needs to, I am very supportive and it makes it easier for him. 

However, you can coach yourself instead of needing someone else to. Try to look at it objectively or as if it's someone else. Your partner, friend, parent-- they are sick and ask you if they should take off work? What do you say to them? 

You could even do a pros/cons list. Though certain items on the list should weigh heavier: your physical and mental well-being."
"I just found out about this subreddit and spent the last hour scrolling throught it. Never felt so good in a long time, you guys bring me hope and it is freaking awesome, so many positive vibes and helpfull tips. This is one of the best remedy i ever had.....",Dude same! I found it recently and it helps me so much. Told my therapist all about it.
"Thank you to my car for giving me a place to scream, cry, and have panic attacks in peace.",I feel this... the amount of times I have pulled over by the side of the road and had a mental breakdown lol. Driving calms me and is often the only place I can do anything at home without my parents breathing down my neck (despite me being 23). One huge benefit to getting my license.
Does anyone else obsess over every little thing they say to people?,"I’m 27. Sometimes I get anxiety about things I said to people in 6th grade.

Edit: so I’m reading a lot of comments saying they suffer the same thing. Obsessive thinking like this is a common symptom of other things that aren’t anxiety. Like bipolar disorder and OCD. This is a reminder to make sure you are properly diagnosed. 

I was misdiagnosed for years until I was properly put on the right medication and these thoughts went away. Talk to your doctor because obsessing over thoughts from years ago isn’t a common thing in anxiety disorder. Please talk to your doctor."
"I decided to fight for net neutrality, even with social anxiety. It has been the easiest thing ever.",[deleted]
Anybody else enjoy the rain to calm them down?,[deleted]
Does anyone else still stress out and feel embarrassed over things that happened 10-20 years ago?,"Yes.

I read elsewhere on reddit that if you cringe at a memory, it means you learned something. Most of the stuff you cringe at, no one else would likely remember.

I feel some pity for the person I was, remember what I learned, maybe if I did better subsequent circumstances, and try to just move on to completely different memories."
"I think the most disheartening thing about having anxiety is that it never goes away, you just learn how to cope better with it.",ERP/CBT therapy can reduce Anxiety to normal levels.
does anyone feel like he's existing or surviving rather than living?,For the last 10 years. I feel like I wasted my youth.
Does anyone’s anxiety make them physically sick?,"If it makes you feel better I get these:
Shortness of breath 
Chest pain
Shakes
Nausea
Diarrhea 
And an overhwelming feeling of fear

The symptoms of anxiety are horrible"
"Thank fuck for those new cashier-less ordering machines in McDonalds, I ordered food by myself for the first time in over 4 years","Congrats! I also like using those because you can customize your items without anything getting lost in translation to the cashier, or entered wrong."
Anyone get anxious and paranoid when they're feeling great? ie 'oh fuck when is this going to end and why',Yes alllll the time. I start getting anxiety about not being anxious because I start thinking that I made it all up or I overreacted and now I’m wasting everyone’s time with my obviously fake anxiety because how could someone who’s anxious have moments where they don’t have anxiety????
social media is toxic as fuck,I’m 20F and recently deleted all social media. It’s super freeing I hate how caught up everyone is in it it’s so toxic 
How my agoraphobia makes me feel when I have to leave my house,"Link to the artist's instagram: [johnkennmortensen] (https://www.instagram.com/p/BTjRgQsDXiV/)

I have panic disorder with agoraphobia and I've had to leave the house a good bit lately because of health problems. I saw this gif this morning and it instantly reminded me of how I feel shuffling into yet another doctors office, hospital, clinic, etc, with a constant sense of impending doom hanging over my head that no one else sees, leaving me feeling like a hopeless shell of a person. "
I skipped work today due to my anxiety and now I'm so disappointed with myself. Anyone else ever done the same thing?,"You know, sometimes it’s necessary to take care of our selves. Having anxiety is no different from calling in with the flu. Don’t feel bad. Take care of yourself. Best wishes."
"Hey, Can I have a moment of your time?","I needed this, been overthinking small ass mistakes and can’t stop worrying a lot. Thank you!"
I slept with the lights off for the first time in 15+ years,"Hey, great job! And it doesn't seem small, at least to me. Doing something for 15+ years and then stopping doing that ""something"" is hella difficult. So, kudos to you & good luck 🤞"
Does anyone get the feeling that you're supposed to be worrying about something but you just can't figure out what it is?,"I feel that way all the time. That voice in my head is searching for something to worry about, almost as though if I don't worry about something, bad things will happen. Like I NEED to be worrying about something. I think it may be habits of thought that we have formed. One thing that helps me is reminding myself that sometimes that voice in my head is just anxiety, not me, and I'm that which hears that voice. I hope things improve for you."
When your heart rate is up for no reason all morning and you’re just waiting for the anxiety/panic attack to strike 🤙🏼,It's the worst feeling in the world.
Does anyone else bite their lips or inside of their mouth because of anxiety?,I’m chewing on the inside of my cheeks and lips while reading this
DAE get nervous to return to work or school after you've been away for a little while?,This happens to me a lot.
"I would trade anything in the world, ANYTHING, just to not have anxiety anymore. I just wish this struggle would end.","I'm not saying medication is for everyone, but Sertraline has helped me. It's taken away much of my anxiety and allowed me the headspace to do the necessary work to figure out the root causes of my anxiety and try to change my perspective."
"Anyone else feel so self-aware of their anxiety, it almost feels like you’re faking it?",[deleted]
Does anyone else here always feel like they’re in some sort of trouble or someone is upset with them?,"Yes, all the time... I always assume people don't like me and will make fun of me."
"With anxiety, you know what they say: whatever doesn't kill you makes you 99.99% believe that it will kill you, leaving you to live everyday life legitimately fearing that you will soon die.",Ugh I get this on a DAILY basis. Feel a weird pain in my chest? - heart attack is about to happen. Feel a sharp pain in my head? I'm about to have a stroke. Have an ongoing migraine for a few days? Definitely an unruptured brain aneurysm that is soon to burst. 
Small tattoo but big step,"I love the semi colon movement , and it's awesome that you got that tattoo and are trying to have a positive outlook ❤️ i don't know you at all but I'm proud "
Fuck anxiety,"I wish I could, but it fucks me instead"
Anxiety is just your brain coming up with fake news,"Ha ha, yeah. This https://www.reddit.com/r/Showerthoughts/comments/7mhv6a/anxiety_is_like_when_video_game_combat_music_is/ really explains my feelings. Stupid brain making me think there are threats when there aren't any.

Fake news!"
I drew my anxiety,Captures the essence. How would you draw yourself without anxiety?
I (F17) told my dad about my anxiety and got unexpected reaction,Wow.  You made my eyes fog up.  Very happy for you.
anyone gets stomach upset when anxious ?,"This, 100%.   I get super nauseous with my anxiety peaks.  Which really sucks for things like going out to dinner or anything to do with food.  Then the nausea leads to more anxiety about throwing up, its a vicious cycle."
I got my drivers license.. at 29,Age doesn’t matter friend . We go through life at our own phases . Congrats on getting your license ! Have fun and be safe friend !
The list I keep on my phone to help me calm down during high stress and anxiety,It takes a special person to take this much effort to help others. Thank you
We don't deserve this.,Needed this today. Every day is an accomplishment! We did it! 
Do you ever stay up late even when you’re exhausted to avoid facing the next day? Venting,"Yeah, I'm guilty of doing this a lot for a variety of things. Most recently would probably be over a job I had that wasn't working out. I hated it and started to dread each day so much that I would just stay up as long as I could just to avoid having to wake up and get ready. It made me feel like I was delaying it at least by a little bit."
Has anyone else been anxious since they were a kid?,"I’ve been anxious since puberty. Middle school, around the time I got my period I started becoming really quite and started obsessing over things. High school it turned into anxiety about grades and responsibilities, and now in college it’s everything but I’m on meds and seeing a therapist so I guess that’s good lol. I also notice it gets really bad around my time of the month. Still trying to convince my doctors of it..."
I love you,thank you!
i went to a bookstore and got a coffee by myself today!,"Hey that is awesome!! I know how hard that can be, I have a real problem going to public places alone as well. I'm so proud that you pushed yourself to do this & hope you can always remember how good it felt."
"Today was my first good day in months. My anxiety and depression have stayed low, and I have a positive number in my bank. I feel like I've done some hard work just to have one good day, but it's encouraging.","That's awesome to hear. It's inspiring hearing stuff like this. I just joined the subreddit not even a minute ago. I had such bad anxiety (worst I've ever had multiplied by ten fold) about a week and a half ago, which caused me to feel like I was having a 3 day heart attack. Finally that symptom has subsided, and up until tonight, it's been so much better.

There is hope!"
"My son isn't even two yet, but sat beside me through an anxiety attack.","My daughter's done the same for me! She's just turned two. She goes ""don't cry, mummy"" and brings me a tissue and then sits next to me and holds my hand till it's over. She's the best. "
"Do you ever have a week or two without symptoms and then start to think maybe you're finally getting better, but then you're hit with a day which is worse than you'd remembered?","with you on this.  its extremely aggravating and defeating.  
hope you get back on the ups soon."
I WENT TO A CONCERT BY MYSELF!!,yay :) who’d you go see?
Does anybody get upset if they are going to be late?,Yup....this is a huge trigger for me. I hate being late. I think it is because growing up my family was always late to stuff. 
Does anyone else get anxiety around people there own age but are fine with older people?,"Yes! I am the same way. I think it’s because I feel more pressure to fit in with people my age, so I feel like I gotta change who I am to fit in with them. But with older people, I feel like I can just be who I am. Idk how to change that tho lol"
UPDATE: OH MY GOD YOU GUYS I GOT MY FIRST JOB!!,"Congrats!!! This is a huge step. 

It's not JUST bagging groceries. You're helping to keep a business running, helping them MAKE MONEY. You=value added. 

Good job !!!"
"When I'm anxious, I procrastinate. After I procrastinate, I ruminate. Since I'm ruminating, I'm anxious to even get anything done, that I should have long started, thinking, ""What's the point of doing it now, remember the first time you tried and failed by procrastinating ...""","And anxiety is checking and rechecking number of upvotes or comments, to wonder if I'm the only one who feels like this."
"Here's to all of us at work who have snapped at colleagues, cried quietly at desks (or bathroom), had panic attacks and ruminated about it for hours on end!",[deleted]
Posting literally ANYTHING is so fucking stressful,Well enjoy the karma from this comment and my upvote.
"""A man who fears suffering is already suffering from what he fears""",Very good ! Where is this from ?
"I don't give a shit about ""leaving my comfort zone"", I just want to feel comfortable right now","I hear you, man. I'm not someone who's stuck in their house or anything but I've thrown myself so far out of my comfort zone that I'm struggling to get the days to go by. I wonder what was wrong with staying in my comfort zone and continuing to do what I was doing. I was in a very happy place and now I've got needless stressors. I really didn't need the life skill of how to go to work while your heart is beating a death dirge and you're dry heaving because you hate your job so much. But here we are. Wondering how to go back to the fun side."
"Hey you. Yes, you.",Thank you- needed that
Was suicidal with anxiety eight years ago...getting married on Saturday.,congratulations!!!
Tonight I finally asked the guy in the next apartment over to stop yelling to people over the computer to all hours of the night after about 3 months of trouble sleeping because of the noise.,"I am so proud of you!!!  That's huge (and something that I am not sure I would have been able to accomplish!) 

Well done! And fingers crossed for a good nights sleep :)"
