context,text response
"For the first time ever, I ran with my SHIRT OFF!","Happy for you!

I recently started singing. I used to be afraid of singing in my own room, now I even sing outside my house, quietly - but still. It's so freeing!"
This made me smile,People want to be our lovers? Now that's some anxiety.
I wrote a bit of a poem about self-doubt. My therapist advised that I share it.,"I don't know how this hasn't received more responses because I thought it was great and very accurately represents the experiences of an anxious mind! Really nicely done, and kudos to you for being willing to share something personal such as this. Thank you 💓"
Does anyone here think sometimes that everyone secretly hates them but is only acting nice to them to not be rude?,All. The. Time.
"I got over 50 downvotes on a comment I left as a joke, and cried because I thought I hurt people's feelings","I feel ya. If I get downvotes I generally delete my comment. It's hard for us sensitive folks, this online stuff!"
Anyone have to pee a lot when they get anxious?,For me I get gas and I have to poop a lot. Often times I take Immodium before a job interview or public speaking session to keep my tummy from rumbling constantly.
Fiancée has anxiety during long car rides. How to have a not anxious fiancée. A 6 step process,Fiance is lucky af
Sometimes I wish I had a friend like this.,that is essentially my husband when I have problems with anxiety. I'm lucky he's understanding and supportive. But it still sucks to struggle with it because its an internal thing
"Does anyone else not consider Sunday a ""day off"" since you spend it in a constant state of panic thinking about the next day and week?","Yes! I have never liked Sundays, I feel I need to use the entire day preparing for the upcoming week. I often end up wasting the day worrying or just dreading the week, rather than doing something fun or accomplishing tasks. "
If you're about to get your day / morning started remember this:,"If the day isn't a day you've mastered, you've all day tomorrow to do better. 

Most importantly, be kind to yourself. Life is hard enough"
"After social interactions, namely at work, I get a lot of anxiety thinking about what I said and people’s reaction to it. Keeps me up at night (like now it’s 3am). Specifically I think about how stupid a comment I made was, how desperate I must have seemed,and other negative things. Why is this??","Because you care too much about what other people think about you. People do not give a shit about your ""awkward"" moments, comments etc. and even if they notice they will forget about it pretty soon. Everyone has their own issues and they always focus on themselves. 

I used to care about my public speaking anxiety (i was a litigation laywer) until i literally just stopped giving a fuck. I saw a lot of 40+ people sweating and getting nervous in court when they were about to speak up, but nobody arround them ever seemed to notice or care. Its all in your head.

Nobody remembers or cares about random shit. Sure if the situation was indeed awkward or weird or whatever, some people might make fun of it. Should you even give a fuck?

Fuck no!


Edit: Wow! First time i receive gold! Thank you kind stranger!"
"Deactivated fb, it was damaging me mentally. No one has even noticed!","The only thing that keeps me up on facebook are college groups and to be honest it's the only way to contact people, because no one is eager to even respond to my sms._.
Besides that, long time ago I deleted instagram and snapchat. What do I get from those hundreds of likes and fake friends? Only jealousy and this sick desire of being appreciated by the people I don't even talk to. "
What people think is a cure for anxiety is actually one of its causes.,"That’s exactly what many books on anxiety tell you to do. By not “giving in” to the anxiety, we train our brains to not go into panic mode. Our brain believes what we tell it. So you’re telling your brain that it’s just anxiety, nothing terrible will happen which strengthens your reaction of not panicking! I hope I’m clear. This is great to hear. Now, if I could just be as disciplined as you!"
"I got drunk for the first time in over 6 years this weekend. My anxiety is now so bad, that I am considering suicide.","Anxiety after alcohol consumption is actually fairly common. 

I know it sucks, but it will fade after a week or so. "
"Headed into a store to grab a game that wasn't on Amazon. The workers were too friendly and kinda freaked me out a bit, I was nervous the whole time, but I made it in and out. Woot.","Las time I went to a shop was on Thursday to buy earbuds, I was sweating bullets and shaking, couldnt even talk. Managed to buy the earbuds though"
DAE ever feel like you are rushing through the day to get home to do nothing?,"Yes, and it makes me depressed, too.  I know that if I start doing things that I like again, that I'll feel better, but I feel like my anxiety drains me each day to the point where I just have no motivation at all to do anything.  It makes the days go by too fast, I feel like I'm missing out on life.  How I fight this?  Literally force myself to start doing things I like, or new things.  Like going to the gym after work instead of going home right away, cooking my food instead of getting fast, drawing, music, etc."
I looked after myself today,"That’s awesome, you should absolutely be proud."
I just talked myself down from an anxiety attack!,"yaaaaay well done you! My anxiety turned out to tell me if i don't want certain things or want to get out of certain situations. I wanted out of my relationship, I wanted out of my old job. I would never have actually left those things behind if my anxiety hadn't made me stand up for myself. I was raised to be a ""people pleaser"" and now I'm working on finding out what I really want (and that shit is hard!). Congrats on not letting your anxiety control you!"
I'd like to share with you a picture that helps my confidence.,[deleted]
I am just average and adequate and that's ok!!,You're awesome and you'll do great! We believe in you and wish you the best! 💕
"Ever since I got blue hair I've realised people weren't looking at me before. They are now, and hopefully if I go back to my natural colour I'll be able to remember the difference","Bonus - eventually you get so used to people looking at you that you don't even notice or care, and if you do notice you know why so it doesn't give you anxiety! 

(I had brightly coloured hair for years, I don't really get any 'they're staring at me' anxiety at all now and haven't for a good few years)"
My anxiety hurts,Yep. Tightness in the chest or the stomach. Weird tingles make me think death is imminent. Hot flashes cause me to need ice packs on my head. Can't even watch a show to distract myself because I'm so restless and uncomfortable. Anxiety is brutal.
Increased anxiety/ruminating thoughts when your life isn't as busy?,"Yes!! Usually my depressive thoughts get worse when I have time to ponder, with anxiety worse during the term. However, my anxiety does make me feel guilty whenever I’m calm."
I wish I could give my anxiety a body so I can beat its ass.,Lol oh my god this is perfect. I’d fight that peice of shit to the death
Neuroscience study finds that being sleep deprived alters neural pathways that lead to increased fear acquisition mechanisms. How a lack of sleep fuels anxiety related symptoms.,"This makes a lot of sense, from anecdotal experience. I've always found that my bad days (anxiety, irritability and depressive behavoirs) often follow a night of poor sleep. 

Frustratingly, this can become a feedback loop for those, like myself, who suffer insomnia as a symptom of anxiety. Best solution I have found is to take some form of sedative about an hour before bed, whether that's a prescription, or OTC like benadryl. "
Has anyone here ever screamed/felt like screaming from how anxious and overwhelmed you feel? I need someone to understand,"I’ve felt that way before but instead of screaming I go for a drive with music blasting loud and sing my heart out. Usually helps me feel better, plus no one around can judge, win win in my book. Idk if that helps but sending a hug your way!"
does anyone else wake up with a sense of impending doom upon you?,"I sure do. I wake up at 4am every day. Sometimes I get back to sleep for a little bit, but mostly toss and turn. When I finally get out of bed I will play some music on my phone to fill the air, drink a glass of water, and meditate for 5-10 minutes after a shower. That seems to help calm me down a bit."
Anyone else waking up with anxiety?,You're totally explaining my life right now.  With the added bonus that my anxiety keeps me from falling asleep because I'm afraid it'll still be there in the morning. A night of sleep used to help me clear my head and now it seems like the anxiety builds up higher every morning.
I started writing poetry about my anxiety as a form of coping,You're pretty good at it.
My therapist of 4 years just passed away... I want to celebrate him. He helped me through my worst years.,holy shit this was intense to read. I'm sorry for your loss he sounds like a great person
Unsubscribing because I need real help and this sub isn’t really supportive,"I think one thing this sub needs is to focus on helpful info and how to’s. Sharing articles, techniques, etc.  I think that’s infinitely more helpful than just shouting into a void like op mentioned.

Edit: Guys this kind of took off so I’d like to suggest, we should post things that help us. YouTube videos on techniques. Links to books, worksheets, etc. I love seeing success stories but share HOW you got through it, not just what you got through. In essence, be the change you want to see. 

I’m also a member of r/stopdrinking. I’ve got 5 years sober and I would not if it weren’t for them. For examples, come check it out, just to see how it operates."
"sorry if this has been here before, I just relate so much.","Oh I've been there, and yes it has stopped me from purchasing something. I've gotten better, I think a lot of it has to do with how I approach the situation LOL. 

I sound nutty."
Looking back at my life I realized that I had stopped living life. I was literally just trying to get to the next day.,[deleted]
"The loneliest feeling in the world is having a panic attack at like 3am, with no one else home, and it feels like the whole world is asleep and you’re the only one awake.","Been there. It feels like hell in that moment, like you'll never make it to morning "
My tattoo; a little serotonin for when I'm lacking,"Ok that's cute - approved it shall be!   

I have the barcode of a twinkies box on the back of my neck :)"
"Why do I get ""text back"" anxiety?","I get the reverse: “afraid to text back” anxiety. I work two very fast-paced, socially-intense jobs, and when I have a moment to recharge, I hide and cower in my room and attempt to calm myself down. If someone texts me, I think, “Oh, what do they want? Do I have to respond now? Is it important? I’m trying to shut out the world. How do I phrase my response? I can’t think straight. What if I just wait til later when I’m more mentally composed to respond to this?”

Not everyone’s like us, but maybe if you try to imagine they’re going through the same thing, it might help."
posting on Reddit gives me anxiety - so this is me fighting that anxiety,"I've often held back on posting for similar reasons. That it's not original what I'm saying or that I'll be attacked for what I say. I'll take forever re-reading what I've typed to make sure I've made no mistakes, double checking that no one could possibly take what I'm saying the wrong way or disapprove

I can't really offer any advice on how to get over it, just wanted to let you know you're not alone, and that your voice is equally as valid online as other people's. 

I think that social media, as great as it can be, can easily have this negative effect, as most carry some form of 'approval' system... which isn't all that great 

It's really awesome you got the confidence to make this post by the way. Congrats :) "
I got my first 'real' job and survived my first day--8 hours--without letting my panic take control.,"fuck yeah, you went for and then got a job you wanted (a huge thing for *anybody*, let alone someone suffering from anxiety), and you powered through the first day (again, often pretty overwhelming even for someone who doesn't have anxiety) without having a panic attack. that is awesome on all counts."
Valentine’s Day should also be a reminder of SELF-LOVE,This is a hard exercise for me... Thanks a lot for your reminder. Happy Valentine's
Anyone else afraid of texting?? I tend to leave so many people on read because I don’t know what to say. I think if I continue the conversation I’ll just end up bothering them...then I end up coming across as rude ):,"I go the complete opposite direction and send too much. 

I get worried that the first message i sent wasn't good enough / was weird so i oversend which tends to piss people off and then make it worse haha

I'm curious to see in future if texting has any impact on mental health"
I hate calling people,"Jeeze I really hate the phone too, to the point that if I have to do something over the phone, I put if off for, sometimes, *weeks*. I prevents me from keeping in touch with my family as much as I'd like, as I always get super anxious before I call them, or when they call.

> If I tell them I don't know, they seem to get frustrated at me. Sorry that I don't know everything.

If they really get frustrated, screw them, doing stuff over the phone isn't ideal for anyone involved, there's no reason for you to say sorry! "
I made a small accomplishment today! I managed to go to the gym alone.,That is really great! Anxiety can make our world become so small and every step we take to press the boundaries out takes so much courage.  I hope this gives you confidence to continue to challenge your anxiety and to continue to be so brave.  You should be so proud of yourself!
After 6 months of struggling to get a job I’ve finally done it!!,And it did brighten my day! It's awesome you're sharing this beautiful moment. Go on! Best of luck for your new adventure!
Guys if anyone is out there I’m feeling really small and deflated and I just found this sub for the first time I just wanted to say that reading your posts is so heartwarming and you guys all seem so nice 💕💕,"I started visiting this subreddit around a week ago and I wholeheartedly agree. Normally, Reddit triggers my anxiety, but /r/anxiety reminds me that I'm okay. It's ironic that a subreddit about anxiety happens to be the one that has helped me combat my anxieties."
"Friendly reminder to anyone in the the US (yes this includes cali and florida, you're not exempt): if you have anxiety or depression, this is the time to get tested for low vitamin d and possibly start supplements. Winter blues are upon us folks","Also for Canadians, as northern climes mean shorter daylight spans. Canadians, try ordering Vitamin D3 from the US if you, like me, see only 1000 IU bottles in brick-and-mortar retailers. When I lived around the 48th parallel I started 5000-10000 IU a day from November to March."
"Is it just me, does anyone else’s chest feel tight and have a slight headache most of the day every day?","Yes, sadly. Also comes with slight off and on dizziness."
Anyone get anxious about calling out of work?,"I do, I think it’s somewhat normal. It’ll be ok, you have the right to call out. "
"Sometimes anxiety tells me everyone will hate me and laugh the moment I am noticed, but then depression tells me that no one cares about me enough to even feel such strong emotions like hate....","I have both right now. One minute I don’t want to talk to people cause I want to be alone, but the next, I’m stressing out about how they hate me..."
"Anxiety is the sensation that nothing has ever been okay, and never will be.","But that feeling is a lie; it eventually passes. Hang in there everyone, it gets better 💚"
"Does anyone else get terrible anxiety from movers or cable guys coming over into your space? It completely depletes my energy, as if I ran for miles. Serious fight or flight mode.","Absolutely. Like you said ""coming over into your space"". I don't even like people that aren't family or close friends in my home, at all. Not even all of my family are welcome to me at home. Strangers though? Can't stand it, constant anxiety and worrying."
Anxiety is like when video game combat music is playing but you can't find any enemies.,"""You cannot sleep when enemies are nearby."""
Anyone else distract themselves by going on the internet?,"Obligatory ""are you me???"" I have ADHD as well as anxiety so I can lose myself for hours watching random shit on Youtube. It's incredibly unhealthy and I'd say I'm addicted to the internet; most of the time that I'm using it I don't even enjoy what I'm doing - it's almost like being in purgatory, where I can momentarily forget how shit my life is, yet simultaneously feel too guilty to do things that I actually enjoy."
"When my counselor told me it's usually ""smart"" people who develop anxiety (x-post from r/adviceanimals)",We are totally circlejerking our intelligence in this thread. 
"Question: do you guys pretend to like things in order to fit in and be accepted and liked,so much so that you don’t even know what you actually like anymore? Like,your whole personality is a facade?",I once pretended to be into furries because i had a crush on someone who was really into them. Biggest regret of 2018
"If I’m more than 2 minutes late, I often don’t go to a class out of fear of what others will think","Going to class when late is hard as hell, but missing class then trying to go to the next one is exponentially harder. Already did that to one of my classes this semester. "
I got a job!,Congrats! Is it your first job? Asking because I'm looking for a job and wanted to know if you can give me any tips
Frequently i will put headphones in and then forget to turn music on. I think it's because that little bit of muffling helps me calm down and think straight. Kind of like a little hug - it's comforting. Anyone else do this? or something similar?,"Definitely. I think it helps cut down sensory overload. 

I found a really good, kinda related tactic to calm down while panicking recently. My SO had put my head to his chest and covered my other ear, which muffled everything. All I could hear was his breathing and his heartbeat. Works pretty quickly and effectively for me."
"Today is a really, really, really, hard, no good, bad day.","I feel like this too. It's ok, you're ok, everything is ok."
I check to make sure my alarm is set at least 10 times before I go to bed. Anyone else do this?,"I have OCD, sounds like an OCD thing."
I just gave my number to a girl!,"I am a woman who suffers from anxiety but as a counter point to one of the other comments, this is actually how I PREFER to be approached in public by someone who is interested in me. I feel the way you went about it is the optimal way to approach a woman tbh. By waiting until just before she got off the bus and handing her YOUR number, you did two very important things: 1) Gave her an immediate “escape” in the event that she WAS uncomfortable and 2) Put the power in her hands so that she could CHOOSE whether or not she wanted to have further contact with you. This kind of interaction would not only boost my confidence and make me feel good, but I would really respect how the person did it in a way that didn’t make me feel awkward or cornered, which typically happens when I’m chatted up by some random dude in public. In my eyes, this was a perfect, respectful interaction so kudos to you OP!! And I’m so proud of you for being SO freakin brave too. "
I utterly hate it when someone tells me that I am wrong. Not because I want to be right but because it makes me feel that I am an idiot or inadequate,Well. This is pretty relatable.
When anxiety makes you want to do things but depression makes you want to stay in bed,Fire and ice. It’s a bitch.
Anxiety as an older male sucks,"This is the reason anxiety in men disproportionate manifests as anger issues. Society allows us a handful of acceptable emotions and everything else is weakness. And an excuse for other males to abuse us inorder to maintain their place above the bottom rung in the man box. So we get conditioned to rely entirely on the fight response. As flight is not an acceptable outcome. 
 And if we are lucky enough to avoid that conditioning, we get labeled a weak coward. And made an outcaste or punching bag for the man box. 
The things we need to manage our anxiety healthily are also denied us. Things like a supporting community, platonic physical affection, and positive emotional outlets. You are labeled as gay, or a bitch if you try to express anything beyond anger, lust and hunger. 
The point is, don't let society lable you. Be who you need to be. Find people that support it. And you'll find your own strengths

Update: Small edit for a typo. And just wanted to clarify something. As upon re reading I realized something that I said could be read a certain way.  Being gay isn't in itself a bad thing. Rather it's another method of exclusion and domination used by the Man Box inorder to force this brutal peking order on us. Anything that is outside the very narrow definitions of masculinity that our society uses. Will be used as such.

And for more information on the ""Man Box"" idea. https://medium.com/@remakingmanhood/the-history-of-the-man-box-e6eed6d895c4"
If anxiety is keeping you awake right now...,I needed this :) Im up at 6 am without sleeping at all and feeling anxious all night. That made me feel a little better though. Thank you
Shout out to all the S.O.'s who accept us,"I hear you man. Mine just drove me home from a gig I was asked to do. I played, then ten minutes after I stepped off stage I was a wreck, shaking, unable to catch my breath. She drove me home, made me tea, put me to bed.

I don't know how she can put up with this mess but damn, I love her more than words can say."
Be aware of your distorted thinking,"I think I knew some of this, but having it written out if fantastically helpful, thank you so much for this post!"
Anyone else with anxiety have a crippling fear of confrontation?,"Yes, but for me it's because no matter what I said growing up, I was always wrong. No one ever listened to my side and when they did, I was still wrong even though I was right. I get scared that it will escalate into crazy violence (That's how mum reacted when she knew she was wrong and still wanted things her way) and it's just stuck with me. I can argue with my boyfriend. We get into silky arguments though over things and luckily we both deal with it maturely. There's no yelling, no swearing, no meanness or anger, it's more like a debate where both sides will have their say then we deal with it. I guess that's the healthy way of dealing with things."
I went to the store by myself today,"Fuck yes!

Man I remember when I was like that, simple things being super scary and impossible. It's still like that sometimes, but it's better now. You'll get there. Celebrating and being conscious of the little achievements like this is how we get a handle on this mess. Good job!"
I immerse myself in TV shows like Scrubs and How I Met Your Mother to make up for the absence of real life friend groups.,"I think this is extremely common. Even with people who have great, supportive social circles. The way the groups of fictional characters interact is a sort of hyper-reality: more meaningful, more emotional, almost mechanical in its efficiency. And when they teach each other lessons, they also teach you. In something like an episodic show, the ""lesson"" is both introduced, explained, demonstrated, and expanded upon in the same episode. Real life is rarely so neat.

I think you would be extremely hard-pressed to find someone who did not at some point wish they were part of a fictional group of friends and also in a small way feel like they were. 

I think if you look at works of ficiton that have large fan fiction communities, you will find elements like this. People sort of fall in love with these people and don't want their stories to end. By continuing these stories its like they get to hang out with their fictional friends some more. I think it's a really important part of the magic of fiction. People often say the characters are what make the story but many people don't understand why. It's because properly developed characters aren't just lifelike, they are more emotionally affecting than a real person can be, because they are engineered to be so and their whole world bends to them being so."
Take a moment to breathe.,"That's a good one. I would prefer the out breath to be just a smidget longer, the way the triangle stays for a second, but otherwise it's a nicely calming tempo."
"Try this pill , take this supplement, this might make you suicidal but it could relieve you from anxiety , this antidepressant will work but not forever , higher dose, to high now you have side effects , to low...nothing . Let’s try something else. For FUCKSAKE I JUST WANT TO FEEL NORMAL !",The truth is doctors don’t know close to the entirety of how our brains work.
Anyone else feel safer in confined spaces? On rough days I just hide away in my own little world under a blanket and draw stuff. Anxiety can’t get in here.,Yes! I sit in the shower for hours lmao
I DID IT,great work! i'm happy to read your accomplishment :] 
